{
  "id": "e1f53a47-7574-4fd6-98f1-afb845647458",
  "pageType": "blog",
  "slug": "best-fishing-knots",
  "title": "Best Fishing Knots: Complete Guide for Every Situation",
  "description": "- Lure/Bait Choice: Use monofilament for topwater lures and braided for heavy cover. - Where to Fish: Near structures like docks and submerged vegetation.",
  "body": "# Best Fishing Knots: Complete Guide for Every Situation\n\n**Best for:** All skill levels  \n**What you need:** Monofilament line, braided line, hook, lure\n\n**DO THIS FIRST:** Start by mastering the Palomar knot for its strength and versatility.\n\n## Quick Answer\n\n- **Lure/Bait Choice:** Use monofilament for topwater lures and braided for heavy cover.\n- **Where to Fish:** Near structures like docks and submerged vegetation.\n- **Retrieve Pattern:** Slow and steady for clear waters; erratic for stained waters.\n- **Best Conditions:** Early morning or late afternoon with moderate wind.\n- **Tide/Time/Wind:** Light winds, rising tide, and overcast skies increase success.\n\n## Tackle Box Snapshot\n\n- **Lure/Bait Options:** Zoom Trick Worm, Rapala X-Rap, Berkley Gulp! Minnow\n- **Hook/Jig Weights:** 1/4 oz for shallow (2-4 feet), 1/2 oz for medium (4-8 feet), 1 oz for deep (8-12 feet)\n- **Line/Leader Setup:** 15 lb monofilament for low visibility, 30 lb braided for strength.\n- **Retrieve Patterns:** Slow roll for worms, twitch-pause for minnows, steady crank for crankbaits.\n- **Target Depth/Structure:** Focus on 6-10 feet near drop-offs and submerged timber.\n\n![Fishing tackle and lures laid out](https://images.unsplash.com/photo-1515023115689-589c33041d3c?w=800&h=600&fit=crop)\n*Caption describing the complete setup and scenarios it covers*\n\n## Step-by-Step\n\n1. **Where to Start:** Begin near submerged structures like logs or rocks at 6-10 feet depth.\n2. **First Casts:** Cast at a 45-degree angle, aiming for 30 feet distance from the boat.\n3. **Retrieve Cadence:** Use a slow, deliberate retrieve; feel for subtle taps or resistance.\n4. **Hookset and Landing Tips:** When feeling a bite, set the hook with a quick upward jerk and reel smoothly.\n5. **What to Change:** After 10-15 minutes with no bites, switch to a faster retrieve or change lure colors.\n\n![Angler casting or fishing technique demonstration](https://images.unsplash.com/photo-1544552866-d3ed42536cfd?w=800&h=600&fit=crop)\n*Caption explaining the technique and why it matters*\n\n## Decision Tree\n\n- **If water is clear:** Use natural colors and a slow retrieve.\n- **If water is stained:** Switch to bright colors like chartreuse and retrieve more erratically.\n- **If windy:** Opt for a heavier lure to maintain control and contact with the lure.\n- **If cold front/pressure drop:** Fish deeper and slower to entice lethargic fish.\n- **If bait is present:** Match the hatch with similar-sized lures and colors.\n- **If no bait visible:** Use search baits like spinnerbaits to cover more water quickly.\n\n## Spot Playbook\n\nFor targeting bass, focus on underwater structures such as docks, weed lines, and drop-offs. Bass often stage along edges and shadows, particularly in 5-10 feet of water. Approach quietly and cast from a distance to avoid spooking fish. The strike zone is typically within 3-5 feet of these structures, so precision is key.\n\n![Fishing structure or habitat photo](https://images.unsplash.com/photo-1559827260-dc66d52bef19?w=800&h=600&fit=crop)\n*Caption with depth, conditions, and when to target this spot*\n\n## Mistakes That Kill the Bite\n\n- Retrieving too fast can scare fish away.\n- Fishing at the wrong depth misses where fish are holding.\n- A noisy approach alerts fish to your presence.\n- Overworking the lure makes it look unnatural.\n- Casting at the wrong angle to the current can drag the lure unnaturally.\n- Not pausing long enough during retrieves loses interest.\n- Changing spots too quickly misses potential bites.\n- Setting the hook on topwater explosions too soon results in misses.\n- Fishing the wrong tide stage can limit fish activity.\n- Using dull hooks reduces hook-up success.\n- Leader too short can result in spooking fish.\n- Ignoring shadow lines can miss ambush points.\n\n![Fish or detail closeup](https://images.unsplash.com/photo-1592329347327-27c7e288b5f6?w=800&h=600&fit=crop)\n*Caption highlighting successful technique or important detail*\n\n## Frequently Asked Questions\n\n**What is the strongest fishing knot?**  \nThe Palomar knot is widely considered the strongest due to its double line wrap, which increases strength and prevents slipping.\n\n**How do you tie a fishing knot?**  \nStart by threading the line through the hook eye, then form a loop. Wrap the line around the main line five times, pass it through the loop, and pull tight.\n\n**What knot is best for hooks?**  \nThe improved clinch knot is excellent for tying hooks, providing a strong hold and easy tying process.\n\n**How do you tie line to a lure?**  \nUse the loop knot for lures to allow free movement, enhancing the lure's action in the water.\n\n**What is the easiest fishing knot?**  \nThe overhand knot is the simplest, but for fishing, the improved clinch knot is both easy and effective.\n\n## 1-Minute Action Plan\n\n1. **Rig to tie on:** Use a Palomar knot with 15 lb braid connected to a Zoom Trick Worm.\n2. **2 places to try first:** Target the weed line edges and submerged timber.\n3. **First retrieve cadence:** Employ a slow roll with intermittent pauses.\n4. **One adjustment if no bites:** Switch to a bright-colored lure and increase retrieve speed.\n\nReady to catch more fish? Download the Tackle app to log your catches, track patterns, and discover hot spots near you.\n\n## Next Steps: Keep Learning\n\n- If you're fishing mangroves next, check out our [best bass lures guide](/blog/best-bass-lures).\n- If you need the right rod setup, explore our [fishing rods guide for Florida](/blog/best-fishing-rods-florida).\n- If you want to learn knots, our [fishing tips for beginners](/blog/fishing-tips-for-beginners) is a great resource.\n\n## Always Check Current Regulations\n\nFishing regulations vary by location and change regularly. Always verify current rules with local authorities before fishing. [Check local regulations for current rules](https://www.tackleapp.com).\n\n---\n\n**Sources:**  \n- [Fishing Research](https://www.tackleapp.com)",
  "headings": [
    {
      "level": 1,
      "text": "Best Fishing Knots: Complete Guide for Every Situation",
      "id": "best-fishing-knots-complete-guide-for-every-situation"
    },
    {
      "level": 2,
      "text": "Quick Answer",
      "id": "quick-answer"
    },
    {
      "level": 2,
      "text": "Tackle Box Snapshot",
      "id": "tackle-box-snapshot"
    },
    {
      "level": 2,
      "text": "Step-by-Step",
      "id": "step-by-step"
    },
    {
      "level": 2,
      "text": "Decision Tree",
      "id": "decision-tree"
    },
    {
      "level": 2,
      "text": "Spot Playbook",
      "id": "spot-playbook"
    },
    {
      "level": 2,
      "text": "Mistakes That Kill the Bite",
      "id": "mistakes-that-kill-the-bite"
    },
    {
      "level": 2,
      "text": "Frequently Asked Questions",
      "id": "frequently-asked-questions"
    },
    {
      "level": 2,
      "text": "1-Minute Action Plan",
      "id": "1-minute-action-plan"
    },
    {
      "level": 2,
      "text": "Next Steps: Keep Learning",
      "id": "next-steps-keep-learning"
    },
    {
      "level": 2,
      "text": "Always Check Current Regulations",
      "id": "always-check-current-regulations"
    }
  ],
  "primaryKeyword": "best fishing knots",
  "secondaryKeywords": [
    "what is the strongest fishing knot",
    "how do you tie a fishing knot",
    "what knot is best for hooks",
    "how do you tie line to a lure",
    "what is the easiest fishing knot",
    "fishing-tips"
  ],
  "categorySlug": "fishing-tips",
  "tags": [
    "what is the strongest fishing knot",
    "how do you tie a fishing knot",
    "what knot is best for hooks",
    "how do you tie line to a lure",
    "what is the easiest fishing knot"
  ],
  "faqs": [
    {
      "question": "What is the strongest fishing knot?",
      "answer": "The Palomar knot is widely considered the strongest due to its double line wrap, which increases strength and prevents slipping."
    },
    {
      "question": "How do you tie a fishing knot?",
      "answer": "Start by threading the line through the hook eye, then form a loop. Wrap the line around the main line five times, pass it through the loop, and pull tight."
    },
    {
      "question": "What knot is best for hooks?",
      "answer": "The improved clinch knot is excellent for tying hooks, providing a strong hold and easy tying process."
    },
    {
      "question": "How do you tie line to a lure?",
      "answer": "Use the loop knot for lures to allow free movement, enhancing the lure's action in the water."
    },
    {
      "question": "What is the easiest fishing knot?",
      "answer": "The overhand knot is the simplest, but for fishing, the improved clinch knot is both easy and effective."
    }
  ],
  "sources": [
    {
      "label": "Fishing Research",
      "url": "https://www.tackleapp.com",
      "retrievedAt": "2026-01-13T21:26:04.150Z"
    }
  ],
  "related": {
    "speciesSlugs": [],
    "howToSlugs": [],
    "locationSlugs": [],
    "postSlugs": [
      "best-bass-lures",
      "fishing-tips-for-beginners",
      "best-fishing-rods-florida"
    ]
  },
  "author": {
    "name": "Tackle Team",
    "url": "/about"
  },
  "dates": {
    "publishedAt": "2026-01-13T21:26:25.942Z",
    "updatedAt": "2026-01-13T21:26:25.942Z"
  },
  "flags": {
    "draft": false,
    "noindex": false
  },
  "ctas": [
    {
      "position": "top",
      "type": "app_download"
    },
    {
      "position": "end",
      "type": "app_download"
    }
  ],
  "alternativeRecommendations": []
}