{
  "id": "e1cb7a22-6e38-4e80-9230-be54ae5d612f",
  "pageType": "blog",
  "slug": "fishing-safety-tips",
  "title": "Fishing Safety Tips: Essential Guide for Safe Angling",
  "description": "Best for: All skill levels  \nWhat you need: Rod, reel, lure, safety gear  \nDO THIS FIRST: Always wear a life jacket while fishing near or on the water.",
  "body": "# Fishing Safety Tips: Essential Guide for Safe Angling\n\nBest for: All skill levels  \nWhat you need: Rod, reel, lure, safety gear  \n**DO THIS FIRST**: Always wear a life jacket while fishing near or on the water.\n\n## Quick Answer\n\n- **Lure/Bait Choice**: Use 3-inch soft plastic worms or crankbaits like the Rapala Shad Rap.\n- **Where to Fish**: Target structures such as docks and submerged trees in 5-10 feet of water.\n- **Retrieve Pattern**: Try a slow and steady retrieve with occasional pauses.\n- **Best Conditions**: Fish early morning or late afternoon during low-light conditions.\n- **Wind and Tide**: Fish with the wind at your back and during incoming tides for better action.\n\n## Tackle Box Snapshot\n\n- **Lures**: Rapala Shad Rap, Zoom Trick Worms, and Berkley Gulp Minnows.\n- **Hook/Jig Weights**: Use 1/8 oz jig heads for shallower waters (2-5 feet) and 1/4 oz for deeper waters (6-10 feet).\n- **Line/Leader Setup**: Spool with 10 lb test braided line, attach a 12 lb fluorocarbon leader.\n- **Retrieve Patterns**: Slow, steady retrieve for crankbaits; twitch-pause for soft plastics.\n- **Target Depth/Structure**: Focus on 5-10 feet near submerged logs and rocky drop-offs.\n\n![Fishing tackle and lures laid out](https://images.unsplash.com/photo-1515023115689-589c33041d3c?w=800&h=600&fit=crop)\n*Caption describing the complete setup and scenarios it covers*\n\n## Step-by-Step\n\n1. **Where to Start**: Position yourself near a dock or submerged structure, maintaining a distance of 20-30 feet.\n2. **First Casts**: Cast at a 45-degree angle to cover more water, aiming for a distance of 30-40 feet.\n3. **Retrieve Cadence**: Feel for slight taps or resistance; maintain a slow retrieve with pauses every 5 seconds.\n4. **Hookset and Landing Tips**: Set the hook firmly when you feel a solid tug; keep the rod tip up while reeling in.\n5. **What to Change**: After 10-15 minutes with no bites, switch to a different lure color or try a faster retrieve.\n\n![Angler casting or fishing technique demonstration](https://images.unsplash.com/photo-1544552866-d3ed42536cfd?w=800&h=600&fit=crop)\n*Caption explaining the technique and why it matters*\n\n## Decision Tree\n\n- **If Water is Clear**: Use natural colors like green and brown; slow down retrieve for wary fish.\n- **If Water is Stained**: Opt for bright colors like chartreuse or white; increase retrieve speed.\n- **If Windy**: Use heavier lures to maintain contact; cast with the wind to cover more area.\n- **If Cold Front/Pressure Drop**: Fish deeper with smaller lures; slow down your presentation.\n- **If Bait is Present**: Match the hatch with similarly sized lures; use a stop-and-go retrieve.\n- **If No Bait Visible**: Use lures with more vibration or noise like crankbaits to attract fish.\n\n## Spot Playbook\n\nThe best spots for fishing include rocky drop-offs and submerged tree lines in 6-12 feet of water. Fish tend to stage at the edges of these structures, waiting to ambush prey. Approach from a distance of at least 30 feet to avoid spooking them. Cast parallel to drop-offs, letting your lure sink to the bottom before starting the retrieve. The optimal strike zone is within 2-3 feet off the bottom.\n\n![Fishing structure or habitat photo](https://images.unsplash.com/photo-1559827260-dc66d52bef19?w=800&h=600&fit=crop)\n*Caption with depth, conditions, and when to target this spot*\n\n## Mistakes That Kill the Bite\n\n- Casting too far from the target structure misses the strike zone.\n- Retrieving too fast can startle fish; slow down for better results.\n- Being noisy on approach scares fish away; be stealthy.\n- Overworking the lure reduces its natural appeal; keep it subtle.\n- Wrong angle to current disrupts lure presentation; adjust angle.\n- Not pausing long enough during retrieve misses strike opportunities.\n- Changing spots too quickly without thoroughly fishing an area.\n- Setting the hook too early on topwater explosions; wait a moment.\n- Fishing during the wrong tide stage reduces chances; check conditions.\n- Using dull hooks prevents effective hooksets; sharpen them.\n- Leader too short can spook fish in clear water; use at least 3 feet.\n- Ignoring shadow lines where fish often hide from predators.\n\n![Fish or detail closeup](https://images.unsplash.com/photo-1592329347327-27c7e288b5f6?w=800&h=600&fit=crop)\n*Caption highlighting successful technique or important detail*\n\n## Frequently Asked Questions\n\n**What is the best way to catch fish?**  \nFocus on matching the hatch and using natural lure colors. Cast near structures and vary your retrieve speed to find what works best.\n\n**When is the best time to fish for fish?**  \nEarly morning and late afternoon provide the best conditions due to lower light levels and increased fish activity.\n\n**What bait or lures work for fish?**  \nSoft plastics like Zoom Trick Worms and crankbaits such as the Rapala Shad Rap are effective in most conditions.\n\n**Where can I find fish?**  \nLook for fish near submerged structures like logs, docks, and drop-offs. These areas offer cover and feeding opportunities.\n\n**What gear do I need for fish fishing?**  \nA medium-action rod, a spinning reel spooled with 10 lb braided line, and a selection of soft plastics and crankbaits are essential.\n\n## 1-Minute Action Plan\n\n1. **Rig to Tie On**: Use a 3-inch Zoom Trick Worm with a 1/8 oz jig head.\n2. **2 Places to Try First**: Check out the dock near the eastern shore and the submerged tree line on the western bank.\n3. **First Retrieve Cadence**: Use a slow, steady retrieve with a 3-second pause every few feet.\n4. **One Adjustment if No Bites**: Switch to a crankbait like the Rapala Shad Rap and increase retrieve speed.\n\nReady to catch more fish? Download the Tackle app to log your catches, track patterns, and discover hot spots near you.\n\n## Next Steps: Keep Learning\n\n- If you're fishing mangroves next, check out our [best time to fish](/blog/best-time-to-fish).\n- If you need the right rod setup, read our [fishing tips for beginners](/blog/fishing-tips-for-beginners).\n- If you want to learn knots, explore our [best bass lures](/blog/best-bass-lures).\n\n## Always Check Current Regulations\n\nFishing regulations vary by location and change regularly. Always verify current rules with local authorities before fishing. [Check local regulations for current rules](https://www.tackleapp.com).\n\n---\n\nSources: [Fishing Research](https://www.tackleapp.com)",
  "headings": [
    {
      "level": 1,
      "text": "Fishing Safety Tips: Essential Guide for Safe Angling",
      "id": "fishing-safety-tips-essential-guide-for-safe-angling"
    },
    {
      "level": 2,
      "text": "Quick Answer",
      "id": "quick-answer"
    },
    {
      "level": 2,
      "text": "Tackle Box Snapshot",
      "id": "tackle-box-snapshot"
    },
    {
      "level": 2,
      "text": "Step-by-Step",
      "id": "step-by-step"
    },
    {
      "level": 2,
      "text": "Decision Tree",
      "id": "decision-tree"
    },
    {
      "level": 2,
      "text": "Spot Playbook",
      "id": "spot-playbook"
    },
    {
      "level": 2,
      "text": "Mistakes That Kill the Bite",
      "id": "mistakes-that-kill-the-bite"
    },
    {
      "level": 2,
      "text": "Frequently Asked Questions",
      "id": "frequently-asked-questions"
    },
    {
      "level": 2,
      "text": "1-Minute Action Plan",
      "id": "1-minute-action-plan"
    },
    {
      "level": 2,
      "text": "Next Steps: Keep Learning",
      "id": "next-steps-keep-learning"
    },
    {
      "level": 2,
      "text": "Always Check Current Regulations",
      "id": "always-check-current-regulations"
    }
  ],
  "primaryKeyword": "fishing safety tips",
  "secondaryKeywords": [
    "what is the best way to catch fish",
    "when is the best time to fish for fish",
    "what bait or lures work for fish",
    "where can i find fish",
    "what gear do i need for fish fishing",
    "fishing-tips"
  ],
  "categorySlug": "fishing-tips",
  "tags": [
    "what is the best way to catch fish",
    "when is the best time to fish for fish",
    "what bait or lures work for fish",
    "where can i find fish",
    "what gear do i need for fish fishing"
  ],
  "faqs": [
    {
      "question": "What is the best way to catch fish?",
      "answer": "Focus on matching the hatch and using natural lure colors. Cast near structures and vary your retrieve speed to find what works best."
    },
    {
      "question": "When is the best time to fish for fish?",
      "answer": "Early morning and late afternoon provide the best conditions due to lower light levels and increased fish activity."
    },
    {
      "question": "What bait or lures work for fish?",
      "answer": "Soft plastics like Zoom Trick Worms and crankbaits such as the Rapala Shad Rap are effective in most conditions."
    },
    {
      "question": "Where can I find fish?",
      "answer": "Look for fish near submerged structures like logs, docks, and drop-offs. These areas offer cover and feeding opportunities."
    },
    {
      "question": "What gear do I need for fish fishing?",
      "answer": "A medium-action rod, a spinning reel spooled with 10 lb braided line, and a selection of soft plastics and crankbaits are essential."
    }
  ],
  "sources": [
    {
      "label": "Fishing Research",
      "url": "https://www.tackleapp.com",
      "retrievedAt": "2026-01-13T21:34:09.201Z"
    }
  ],
  "related": {
    "speciesSlugs": [],
    "howToSlugs": [],
    "locationSlugs": [],
    "postSlugs": [
      "best-time-to-fish",
      "best-bass-lures",
      "fishing-tips-for-beginners"
    ]
  },
  "author": {
    "name": "Tackle Team",
    "url": "/about"
  },
  "dates": {
    "publishedAt": "2026-01-13T21:34:43.590Z",
    "updatedAt": "2026-01-13T21:34:43.590Z"
  },
  "flags": {
    "draft": false,
    "noindex": false
  },
  "ctas": [
    {
      "position": "top",
      "type": "app_download"
    },
    {
      "position": "end",
      "type": "app_download"
    }
  ],
  "alternativeRecommendations": []
}